Topic,Search keyword,merged_text,cleaned_text,text_translated,topic_id,topic_label
心理議題,自我成長,#能量療愈 #自我疗愈 #让世界充满爱 #旅行 #正能量 #自我成长 #勇敢做自己 #人生的意义 #保持快乐 #治愈自己 千万不要小看你自己！你比你想象中强大多了！！！＃治愈自己＃勇敢做自己,能量療愈 自我疗愈 让世界充满爱 旅行 正能量 自我成长 勇敢做自己 人生的意义 保持快乐 治愈自己 千万不要小看你自己 你比你想象中强大多了 治愈自己 勇敢做自己,能量療愈 自我療愈 讓世界充滿愛 旅行 正能量 自我成長 勇敢做自己 人生的意義 保持快樂 治癒自己 千萬不要小看你自己 你比你想象中強大多了 治癒自己 勇敢做自己,5,5_自己_自我_成長_療愈
心理議題,自我成長,為什麼不追逐財富與認同的男人，是社會最大的負擔？ #人生智慧 #自我成長 #個體化 #哲學思考 #哲學語錄,為什麼不追逐財富與認同的男人 是社會最大的負擔 人生智慧 自我成長 個體化 哲學思考 哲學語錄,為什麼不追逐財富與認同的男人 是社會最大的負擔 人生智慧 自我成長 個體化 哲學思考 哲學語錄,10,10_哲學_存在_主義_體化
心理議題,心情,"心情 Xin Qing 伴奏 karaoke 李茂山 Li Mao Shan 
karaoke #novocal #伴奏.",心情 Xin Qing 伴奏 karaoke 李茂山 Li Mao Shan karaoke novocal 伴奏,心情 Xin Qing 伴奏 karaoke 李茂山 Li Mao Shan karaoke novocal 伴奏,25,25_歌曲_this_Short_短褲
心理議題,心情,#shorts 《心情不好的时候，就去做这5件事情！让你豁然开朗》 #正能量剧情  #正能量 #小故事 #原创故事 #正能量语录 #正能量 #成功法则 #生活,shorts 心情不好的时候 就去做这5件事情 让你豁然开朗 正能量剧情 正能量 小故事 原创故事 正能量语录 正能量 成功法则 生活,shorts 心情不好的時候 就去做這5件事情 讓你豁然開朗 正能量劇情 正能量 小故事 原創故事 正能量語錄 正能量 成功法則 生活,6,6_快樂_正_能量_呼吸
心理議題,心情,"心情不好時，請看這個影片，從此你的人生將充滿幸福和快樂｜3個方法幫你在心情低落、焦慮、想哭的時候快速回到平靜！學會了還可以教小孩！ 
心情不好時，請看這個影片，從此你的人生將充滿幸福和快樂｜3個方法幫你在心情低落、焦慮、想哭的時候快速回到平靜！ 你也有 ...",心情不好時 請看這個影片 從此你的人生將充滿幸福和快樂 3個方法幫你在心情低落 焦慮 想哭的時候快速回到平靜 學會了還可以教小孩 心情不好時 請看這個影片 從此你的人生將充滿幸福和快樂 3個方法幫你在心情低落 焦慮 想哭的時候快速回到平靜 你也有,心情不好時 請看這個影片 從此你的人生將充滿幸福和快樂 3個方法幫你在心情低落 焦慮 想哭的時候快速回到平靜 學會了還可以教小孩 心情不好時 請看這個影片 從此你的人生將充滿幸福和快樂 3個方法幫你在心情低落 焦慮 想哭的時候快速回到平靜 你也有,6,6_快樂_正_能量_呼吸
心理議題,心情,"心情冷靜咒｜適合心情不穩、焦慮、生氣時播放 #平復心情 #舒緩焦慮 #冷靜情緒 
空間淨化#能量音樂#療癒音樂#淨化音樂#sleepmusic #healing #Relaxmusic #睡覺音樂#療癒#能量#靈性#靈性音樂#冥想#舒眠 ...",心情冷靜咒 適合心情不穩 焦慮 生氣時播放 平復心情 舒緩焦慮 冷靜情緒 空間淨化 能量音樂 療癒音樂 淨化音樂 sleepmusic healing Relaxmusic 睡覺音樂 療癒 能量 靈性 靈性音樂 冥想 舒眠,心情冷靜咒 適合心情不穩 焦慮 生氣時播放 平復心情 舒緩焦慮 冷靜情緒 空間淨化 能量音樂 療癒音樂 淨化音樂 sleepmusic healing Relaxmusic 睡覺音樂 療癒 能量 靈性 靈性音樂 冥想 舒眠,28,28_愈_音樂_鬆_放
心理議題,心情,#shorts 《心情不好的时候，就去做这5件事情！让你豁然开朗》 #正能量剧情  #正能量 #小故事 #正能量语录 #正能量分享 #正能量 #成功法则 #原创故事 #海外生活 #正能量满满,shorts 心情不好的时候 就去做这5件事情 让你豁然开朗 正能量剧情 正能量 小故事 正能量语录 正能量分享 正能量 成功法则 原创故事 海外生活 正能量满满,shorts 心情不好的時候 就去做這5件事情 讓你豁然開朗 正能量劇情 正能量 小故事 正能量語錄 正能量分享 正能量 成功法則 原創故事 海外生活 正能量滿滿,6,6_快樂_正_能量_呼吸
心理議題,心情,#shorts 《心情不好的时候，就去做这5件事情！让你豁然开朗》 #正能量剧情  #正能量 #原创故事 #正能量语录 #正能量分享 #小故事 #成功法则 #正能量 #海外生活,shorts 心情不好的时候 就去做这5件事情 让你豁然开朗 正能量剧情 正能量 原创故事 正能量语录 正能量分享 小故事 成功法则 正能量 海外生活,shorts 心情不好的時候 就去做這5件事情 讓你豁然開朗 正能量劇情 正能量 原創故事 正能量語錄 正能量分享 小故事 成功法則 正能量 海外生活,6,6_快樂_正_能量_呼吸
心理議題,心情,"情緒修復咒 3HR｜Emotional Healing Mantra｜#修復情緒 #平復心情 #心靈療癒 
情緒平復#脈輪療癒#舒緩焦慮#空間淨化#能量音樂#療癒音樂#淨化音樂#sleepmusic #healing #Relaxmusic #睡覺音樂#療癒#能量# ...",情緒修復咒 3HR Emotional Healing Mantra 修復情緒 平復心情 心靈療癒 情緒平復 脈輪療癒 舒緩焦慮 空間淨化 能量音樂 療癒音樂 淨化音樂 sleepmusic healing Relaxmusic 睡覺音樂 療癒 能量,情緒修復咒3hr情感康復的咒語修復情緒修復情緒平復心情心靈療愈情緒平復舒緩焦慮空間淨化療愈音樂療愈音樂療愈音樂療愈音樂療愈音樂療愈音樂療愈音樂療愈音樂療愈音樂淨化音樂療愈音樂療愈音樂,28,28_愈_音樂_鬆_放
心理議題,心情,"【讓心情放鬆好聽的韓文歌🎧 】2025專屬你的溫暖音樂 💛｜療癒韓文歌單 🎶 讀書📚 工作💼 放鬆🛋 ｜陪你整天的 24/7 音樂直播室 | Music Live for Study, Work 
歡迎來到樂樂的韓文24H不間斷音樂直播室 這是一支為你準備的 【2025最新韓文療癒歌單】精選溫柔清新的Korean Chill Pop曲風， ...",讓心情放鬆好聽的韓文歌 2025專屬你的溫暖音樂 療癒韓文歌單 讀書 工作 放鬆 陪你整天的 24 7 音樂直播室 Music Live for Study Work 歡迎來到樂樂的韓文24H不間斷音樂直播室 這是一支為你準備的 2025最新韓文療癒歌單 精選溫柔清新的Korean Chill Pop曲風,讓心情放鬆好聽的韓文歌 2025專屬你的溫暖音樂 療癒韓文歌單 讀書 工作 放鬆 陪你整天的 24 7 音樂直播室 Music Live for Study Work 歡迎來到樂樂的韓文24H不間斷音樂直播室 這是一支為你準備的 2025最新韓文療癒歌單 精選溫柔清新的Korean Chill Pop曲風,28,28_愈_音樂_鬆_放
心理議題,心情,心情不好、焦慮的時候快試試看😍😍 #開心 #穴道 #開心穴道,心情不好 焦慮的時候快試試看 開心 穴道 開心穴道,心情不好 焦慮的時候快試試看 開心 穴道 開心穴道,6,6_快樂_正_能量_呼吸
心理議題,心情,"💞心情💞 示範老師： 徐嬅雯 黃薁蓁（ 倫巴） 
https://www.youtube.com/@hsuhuawen26（首播） 聯絡電話：0958 335 028 幸福里社區早班土風舞(星期一~星期六)07:30~09:30 ...",心情 示範老師 徐嬅雯 黃薁蓁 倫巴 聯絡電話 0958 335 028 幸福里社區早班土風舞 星期一 星期六 07 30 09 30,心情 示範老師 徐嬅雯 黃薁蓁 倫巴 聯絡電話 0958 335 028 幸福里社區早班土風舞 星期一 星期六 07 30 09 30,2,2_弄_我_頻道_加入
心理議題,心情,当一个人能够影响你心情的时候说明你在乎了#解压 #情感 #人生感悟,当一个人能够影响你心情的时候说明你在乎了 解压 情感 人生感悟,當一個人能夠影響你心情的時候說明你在乎了 解壓 情感 人生感悟,8,8_感情_你_背叛_誰
心理議題,心情,"壞心情害你更容易生病?醫曝免疫力被這件事拖垮!｜十點不一樣20250712 @TVBSNEWS02 
關於情緒和身體健康的關係，醫學研究長期處在負面情緒，像是憂鬱、焦慮、憤怒，然後自責啦、悲觀這些負面情緒是會對身體健康 ...",壞心情害你更容易生病 醫曝免疫力被這件事拖垮 十點不一樣20250712 TVBSNEWS02 關於情緒和身體健康的關係 醫學研究長期處在負面情緒 像是憂鬱 焦慮 憤怒 然後自責啦 悲觀這些負面情緒是會對身體健康,壞心情害你更容易生病 醫曝免疫力被這件事拖垮 十點不一樣20250712 TVBSNEWS02 關於情緒和身體健康的關係 醫學研究長期處在負面情緒 像是憂鬱 焦慮 憤怒 然後自責啦 悲觀這些負面情緒是會對身體健康,0,0_榮格_心理_的_什麼
心理議題,心情,"给我电成紫色心情了 
给我电成紫色心情了.",给我电成紫色心情了 给我电成紫色心情了,給我電成紫色心情了 給我電成紫色心情了,2,2_弄_我_頻道_加入
心理議題,心情,百听不厌的经典闽南歌#架子鼓#浪子的心情 #妞妞架子鼓,百听不厌的经典闽南歌 架子鼓 浪子的心情 妞妞架子鼓,百聽不厭的經典閩南歌 架子鼓 浪子的心情 妞妞架子鼓,4,4_心情_浪子_雨_歌曲
心理議題,心情,"女のきもち★女人的心情~附KTV歌詞~何金溪薩克斯風演奏 
『女のきもち』(女人的心情)，作詞/曲：松原謙，原唱：角川博，1982年06月發行。 『女人的心情』作詞/：董家銘，原唱：江蕙 ...",女のきもち 女人的心情 附KTV歌詞 何金溪薩克斯風演奏 女のきもち 女人的心情 作詞 曲 松原謙 原唱 角川博 1982年06月發行 女人的心情 作詞 董家銘 原唱 江蕙,女のきもち 女人的心情 附KTV歌詞 何金溪薩克斯風演奏 女のきもち 女人的心情 作詞 曲 松原謙 原唱 角川博 1982年06月發行 女人的心情 作詞 董家銘 原唱 江蕙,4,4_心情_浪子_雨_歌曲
心理議題,心情,"壞心情害你更容易生病?醫曝免疫力被這件事拖垮!｜十點不一樣20250712 @TVBSNEWS01 
關於情緒和身體健康的關係，醫學研究長期處在負面情緒，像是憂鬱、焦慮、憤怒，然後自責啦、悲觀這些負面情緒是會對身體健康 ...",壞心情害你更容易生病 醫曝免疫力被這件事拖垮 十點不一樣20250712 TVBSNEWS01 關於情緒和身體健康的關係 醫學研究長期處在負面情緒 像是憂鬱 焦慮 憤怒 然後自責啦 悲觀這些負面情緒是會對身體健康,壞心情害你更容易生病 醫曝免疫力被這件事拖垮 十點不一樣20250712 TVBSNEWS01 關於情緒和身體健康的關係 醫學研究長期處在負面情緒 像是憂鬱 焦慮 憤怒 然後自責啦 悲觀這些負面情緒是會對身體健康,0,0_榮格_心理_的_什麼
心理議題,心情,"壞心情害你更容易生病?醫曝免疫力被這件事拖垮!｜十點不一樣20250712 
關於情緒和身體健康的關係，醫學研究長期處在負面情緒，像是憂鬱、焦慮、憤怒，然後自責啦、悲觀這些負面情緒是會對身體健康 ...",壞心情害你更容易生病 醫曝免疫力被這件事拖垮 十點不一樣20250712 關於情緒和身體健康的關係 醫學研究長期處在負面情緒 像是憂鬱 焦慮 憤怒 然後自責啦 悲觀這些負面情緒是會對身體健康,壞心情害你更容易生病 醫曝免疫力被這件事拖垮 十點不一樣20250712 關於情緒和身體健康的關係 醫學研究長期處在負面情緒 像是憂鬱 焦慮 憤怒 然後自責啦 悲觀這些負面情緒是會對身體健康,0,0_榮格_心理_的_什麼
心理議題,心情,"發一慧音善歌-修道的心情(調寄：浪子的心情) 
如果喜歡我的影片記得幫我點個喜歡想要持續追蹤的話可以訂閱我哦~~ 也可以加入頻道的會員成為小 ...",發一慧音善歌 修道的心情 調寄 浪子的心情 如果喜歡我的影片記得幫我點個喜歡想要持續追蹤的話可以訂閱我哦 也可以加入頻道的會員成為小,發一慧音善歌 修道的心情 調寄 浪子的心情 如果喜歡我的影片記得幫我點個喜歡想要持續追蹤的話可以訂閱我哦 也可以加入頻道的會員成為小,2,2_弄_我_頻道_加入
心理議題,心情,"常常心情不好？被情緒牽著走感覺不舒服嗎？聊聊關於我憂鬱症的過去跟現在 - 20250727直播 
就醫一兩年才確定原來我那樣就是憂鬱症， 很高興現在的人對憂鬱症比過去有概念多了， 但如果你感覺沒有嚴重到要就醫或正考慮 ...",常常心情不好 被情緒牽著走感覺不舒服嗎 聊聊關於我憂鬱症的過去跟現在 20250727直播 就醫一兩年才確定原來我那樣就是憂鬱症 很高興現在的人對憂鬱症比過去有概念多了 但如果你感覺沒有嚴重到要就醫或正考慮,常常心情不好 被情緒牽著走感覺不舒服嗎 聊聊關於我憂鬱症的過去跟現在 20250727直播 就醫一兩年才確定原來我那樣就是憂鬱症 很高興現在的人對憂鬱症比過去有概念多了 但如果你感覺沒有嚴重到要就醫或正考慮,0,0_榮格_心理_的_什麼
心理議題,心情,"把负面情绪留在外面，把好的心情带回家！#名场面 #离谱操作 #杂谈 
名场面#离谱操作#杂谈#搞笑#整活#内容过于真实#感动  你是我藏在小星星里的浪漫   素材来自于网络如有侵权   望告知私我必删.",把负面情绪留在外面 把好的心情带回家 名场面 离谱操作 杂谈 名场面 离谱操作 杂谈 搞笑 整活 内容过于真实 感动 你是我藏在小星星里的浪漫 素材来自于网络如有侵权 望告知私我必删,把負面情緒留在外面 把好的心情帶回家 名場面 離譜操作 雜談 名場面 離譜操作 雜談 搞笑 整活 內容過於真實 感動 你是我藏在小星星裏的浪漫 素材來自於網絡如有侵權 望告知私我必刪,2,2_弄_我_頻道_加入
心理議題,心情,"先处理心情，在处理事情 #国学文化 #智慧人生 #提升自己 #女性智慧 
先处理心情，在处理事情#国学文化#智慧人生#提升自己#女性智慧先处理心情，在处理事情国学文化智慧人生提升自己女性智慧人文 ...",先处理心情 在处理事情 国学文化 智慧人生 提升自己 女性智慧 先处理心情 在处理事情 国学文化 智慧人生 提升自己 女性智慧先处理心情 在处理事情国学文化智慧人生提升自己女性智慧人文,先處理心情 在處理事情 國學文化 智慧人生 提升自己 女性智慧 先處理心情 在處理事情 國學文化 智慧人生 提升自己 女性智慧先處理心情 在處理事情國學文化智慧人生提升自己女性智慧人文,15,15_女人_女性_婚姻_智慧
心理議題,心情,#台灣 #芒果冰 #剉冰 #心情 #美食 #冰品 #點心 #下午茶 #summer #夏天,台灣 芒果冰 剉冰 心情 美食 冰品 點心 下午茶 summer 夏天,臺灣 芒果冰 剉冰 心情 美食 冰品 點心 下午茶 summer 夏天,11,11_喫_心情_今天_飯
心理議題,心情,"赖星丞－心情歌路 
地点：Northsta＠AMKr 主办单位：实龙岗北协灵坛制作单位：荣华娱乐制作乐队：威乐斯.",赖星丞 心情歌路 地点 Northsta AMKr 主办单位 实龙岗北协灵坛制作单位 荣华娱乐制作乐队 威乐斯,賴星丞 心情歌路 地點 Northsta AMKr 主辦單位 實龍崗北協靈壇製作單位 榮華娛樂製作樂隊 威樂斯,2,2_弄_我_頻道_加入
心理議題,心情,"美丽的心情#美丽的心情 #ChineseFolkMusic #VocalCover #ChineseSinger #LivePerformance #心情分享 
一首轻轻唱出的歌，一种最简单也最珍贵的情绪。 愿风吹来好天气，也吹来你今天的美丽心情。 《美丽的心情》——用我的歌声， ...",美丽的心情 美丽的心情 ChineseFolkMusic VocalCover ChineseSinger LivePerformance 心情分享 一首轻轻唱出的歌 一种最简单也最珍贵的情绪 愿风吹来好天气 也吹来你今天的美丽心情 美丽的心情 用我的歌声,美麗的心情 美麗的心情 ChineseFolkMusic VocalCover ChineseSinger LivePerformance 心情分享 一首輕輕唱出的歌 一種最簡單也最珍貴的情緒 願風吹來好天氣 也吹來你今天的美麗心情 美麗的心情 用我的歌聲,4,4_心情_浪子_雨_歌曲
心理議題,心情,"#早安朋友🙏好心情迎來好運氣，平安健康日日有🙏祝你順風順水順財神，財運亨通，橫財入庫，日進斗金，富貴臨門❤️金銀滿倉。財神照拂，好運滾滾來，錢財四季旺，富足過一生🙌#祝福 #早安 #正能量 
早安朋友  好心情迎來好運氣，平安健康日日有  祝你順風順水順財神，財運亨通，橫財入庫，日進斗金，富貴臨門❤️金銀滿倉。",早安朋友 好心情迎來好運氣 平安健康日日有 祝你順風順水順財神 財運亨通 橫財入庫 日進斗金 富貴臨門 金銀滿倉 財神照拂 好運滾滾來 錢財四季旺 富足過一生 祝福 早安 正能量 早安朋友 好心情迎來好運氣 平安健康日日有 祝你順風順水順財神 財運亨通 橫財入庫 日進斗金 富貴臨門 金銀滿倉,早安朋友 好心情迎來好運氣 平安健康日日有 祝你順風順水順財神 財運亨通 橫財入庫 日進鬥金 富貴臨門 金銀滿倉 財神照拂 好運滾滾來 錢財四季旺 富足過一生 祝福 早安 正能量 早安朋友 好心情迎來好運氣 平安健康日日有 祝你順風順水順財神 財運亨通 橫財入庫 日進鬥金 富貴臨門 金銀滿倉,14,14_熱門_佛教_人生_能量
心理議題,心情,"楊麗珍 | 陪酒的心情 | 為你守著一盞燈 | 愛我就跟我走 | 舊愛 | 雨和淚 | 愛你的人不是我 #瑞華唱片（Best Audio Official Video） 
00:00:00 | 陪酒的心情00:03:46 | 為你守著一盞燈00:08:06 | 愛我就跟我走00:11:47 | 舊愛00:15:33 | 雨和淚00:20:02 | 愛你的人不是 ...",楊麗珍 陪酒的心情 為你守著一盞燈 愛我就跟我走 舊愛 雨和淚 愛你的人不是我 瑞華唱片 Best Audio Official Video 00 00 00 陪酒的心情00 03 46 為你守著一盞燈00 08 06 愛我就跟我走00 11 47 舊愛00 15 33 雨和淚00 20 02 愛你的人不是,楊麗珍 陪酒的心情 為你守著一盞燈 愛我就跟我走 舊愛 雨和淚 愛你的人不是我 瑞華唱片 Best Audio Official Video 00 00 00 陪酒的心情00 03 46 為你守著一盞燈00 08 06 愛我就跟我走00 11 47 舊愛00 15 33 雨和淚00 20 02 愛你的人不是,4,4_心情_浪子_雨_歌曲
心理議題,心情,"心情不好，腸胃也跟著罷工？5招讓消化變超順  #心情愉悅 #情緒消化 #壓力影響 #飲食心態 
為什麼情緒會影響消化？ 想像一下，你坐在餐桌前，盯著一盤精心準備的健康餐，卻覺得它像「懲罰」一樣無趣。這不是食物本身的 ...",心情不好 腸胃也跟著罷工 5招讓消化變超順 心情愉悅 情緒消化 壓力影響 飲食心態 為什麼情緒會影響消化 想像一下 你坐在餐桌前 盯著一盤精心準備的健康餐 卻覺得它像 懲罰 一樣無趣 這不是食物本身的,心情不好 腸胃也跟著罷工 5招讓消化變超順 心情愉悅 情緒消化 壓力影響 飲食心態 為什麼情緒會影響消化 想像一下 你坐在餐桌前 盯著一盤精心準備的健康餐 卻覺得它像 懲罰 一樣無趣 這不是食物本身的,0,0_榮格_心理_的_什麼
心理議題,心情,来一首经典闽南歌曲《浪子的心情》😎#星概念架子鼓 #浪子的心情 #女鼓手霸气出场  #妞妞架子鼓,来一首经典闽南歌曲 浪子的心情 星概念架子鼓 浪子的心情 女鼓手霸气出场 妞妞架子鼓,來一首經典閩南歌曲 浪子的心情 星概念架子鼓 浪子的心情 女鼓手霸氣出場 妞妞架子鼓,4,4_心情_浪子_雨_歌曲
心理議題,心情,#水晶 #智商稅 ？  #好運 #旺旺 #心情 #提升自己,水晶 智商稅 好運 旺旺 心情 提升自己,水晶 智商稅 好運 旺旺 心情 提升自己,16,16_玄學_易經_命理_財運
心理議題,心情,#晚霞 陪 #语录 #分享 #风景 #心情 #indosub,晚霞 陪 语录 分享 风景 心情 indosub,晚霞 陪 語錄 分享 風景 心情 indosub,9,9_語錄_人生_正_能量
心理議題,心情,"大罷免投票日 放晴心情好 蔣萬安陪同李彥秀投票! 選戰拚到最後一刻! 李彥秀:努力過了就好! #shorts 
2025不童凡響-中天小小主播夏令營報名請點    https://pse.im/AR369c 2025捍衛新聞&言論自由  請加入中天新聞志工 ...",大罷免投票日 放晴心情好 蔣萬安陪同李彥秀投票 選戰拚到最後一刻 李彥秀 努力過了就好 shorts 2025不童凡響 中天小小主播夏令營報名請點 2025捍衛新聞 言論自由 請加入中天新聞志工,大罷免投票日 放晴心情好 蔣萬安陪同李彥秀投票 選戰拚到最後一刻 李彥秀 努力過了就好 shorts 2025不童凡響 中天小小主播夏令營報名請點 2025捍衛新聞 言論自由 請加入中天新聞志工,2,2_弄_我_頻道_加入
心理議題,心情,"心情好不好，就看闺蜜的八卦多不多#一人分饰多角#宁仔的小剧场#剧情#内容过于真实 
天马行空的故事什么都拍，不做定义.",心情好不好 就看闺蜜的八卦多不多 一人分饰多角 宁仔的小剧场 剧情 内容过于真实 天马行空的故事什么都拍 不做定义,心情好不好 就看閨蜜的八卦多不多 一人分飾多角 寧仔的小劇場 劇情 內容過於真實 天馬行空的故事什麼都拍 不做定義,2,2_弄_我_頻道_加入
心理議題,心情,现在的心情谁懂啊#大眼萌娃 #童言童语 #人类幼崽可爱瞬间,现在的心情谁懂啊 大眼萌娃 童言童语 人类幼崽可爱瞬间,現在的心情誰懂啊 大眼萌娃 童言童語 人類幼崽可愛瞬間,26,26_能_世界_人類_心情
心理議題,心情,"【綜藝一級棒】Radio 的點歌心情 (郭婷筠 吳美琳) #純享版 #閃亮K歌歡唱年代金曲 
歡迎加入一級棒的會員，一起成為級拿棒！ https://www.youtube.com/channel/UCtiGsleU1_kVek-sVNCEyYQ/join 【中視】歌唱 ...",綜藝一級棒 Radio 的點歌心情 郭婷筠 吳美琳 純享版 閃亮K歌歡唱年代金曲 歡迎加入一級棒的會員 一起成為級拿棒 中視 歌唱,綜藝一級棒 Radio 的點歌心情 郭婷筠 吳美琳 純享版 閃亮K歌歡唱年代金曲 歡迎加入一級棒的會員 一起成為級拿棒 中視 歌唱,2,2_弄_我_頻道_加入
心理議題,心情,"死体撃ちに至るまでの心情を数値化してみた。 #shorts #fortnite #ゆっくり実況 #voicevox #aivisspeech 
死体撃ちに至るまでの心情を数値化してみた。 #shorts #fortnite #ゆっくり実況 #voicevox #aivisspeech.",死体撃ちに至るまでの心情を数値化してみた shorts fortnite ゆっくり実況 voicevox aivisspeech 死体撃ちに至るまでの心情を数値化してみた shorts fortnite ゆっくり実況 voicevox aivisspeech,我們量化了導致屍體短褲的感覺的感覺 fortnite slow評論VoiceVox aivissSpeech我們量化了導致屍體短褲射擊的感覺 Fortnite Slow Slow評論Voice Voice Voice Vodic VodicVox aivissspeech,30,30_瑣事_短褲_短_歷史
心理議題,心情,"【每日必看】藍大咖罷免投票心情好!外媒:全球罕見&quot;最狂民主實驗&quot; 20250726 
罷免案#蔣萬安#投票#卓榮泰#侯友宜#立委#政治#監督的力量在中天罷免投票登場，藍綠白大咖都起了大早，前往投票，台北市長- ...",每日必看 藍大咖罷免投票心情好 外媒 全球罕見 quot 最狂民主實驗 quot 20250726 罷免案 蔣萬安 投票 卓榮泰 侯友宜 立委 政治 監督的力量在中天罷免投票登場 藍綠白大咖都起了大早 前往投票 台北市長,每日必看 藍大咖罷免投票心情好 外媒 全球罕見 quot 最狂民主實驗 quot 20250726 罷免案 蔣萬安 投票 卓榮泰 侯友宜 立委 政治 監督的力量在中天罷免投票登場 藍綠白大咖都起了大早 前往投票 臺北市長,2,2_弄_我_頻道_加入
心理議題,心情,自己的健康最重要，所以请保持愉悦的心情。 #郭德纲 #人生感悟 #经典语录,自己的健康最重要 所以请保持愉悦的心情 郭德纲 人生感悟 经典语录,自己的健康最重要 所以請保持愉悅的心情 郭德綱 人生感悟 經典語錄,6,6_快樂_正_能量_呼吸
心理議題,心情,"不要让别人的观点影响自己的心情#爸爸带娃 #童言童语 #人类幼崽成长计划 #童言童语 #萌娃搞笑日常 
镜头后的成长，拍着就长大了哈喽，大家好！我是【小星辰】 ✨2岁8个月啦！人类幼崽的有趣生活✨每天用心记录小星星和爸爸的 ...",不要让别人的观点影响自己的心情 爸爸带娃 童言童语 人类幼崽成长计划 童言童语 萌娃搞笑日常 镜头后的成长 拍着就长大了哈喽 大家好 我是 小星辰 2岁8个月啦 人类幼崽的有趣生活 每天用心记录小星星和爸爸的,不要讓別人的觀點影響自己的心情 爸爸帶娃 童言童語 人類幼崽成長計劃 童言童語 萌娃搞笑日常 鏡頭後的成長 拍着就長大了哈嘍 大家好 我是 小星辰 2歲8個月啦 人類幼崽的有趣生活 每天用心記錄小星星和爸爸的,26,26_能_世界_人類_心情
