Topic,Search keyword,merged_text,cleaned_text,text_translated,topic_id,topic_label
心理議題,心情,"为什么“轻微晒太阳”会让你心情变好？ 
知识#知识shorts计划#知识分享#知识百科#知识科普#冷知识#冷知识科普#人类#science #shortvideo #科普#太阳.",为什么 轻微晒太阳 会让你心情变好 知识 知识shorts计划 知识分享 知识百科 知识科普 冷知识 冷知识科普 人类 science shortvideo 科普 太阳,爲什麼 輕微曬太陽 會讓你心情變好 知識 知識shorts計劃 知識分享 知識百科 知識科普 冷知識 冷知識科普 人類 science shortvideo 科普 太陽,7,7_心理_學_阿德勒_學知識
心理議題,心情,"ये तस्वीर कोई भूल नहीं पाएगा  तो तुम क्या ही भूल पाओगे | Harish Rathod 
""Ho Gaye Door"" – A soulful journey through love and separation. Written and sung straight from the heart by Harish Rathod, this ...",य तस व र क ई भ ल नह प एग त त म क य ह भ ल प ओग Harish Rathod Ho Gaye Door A soulful journey through love and separation Written and sung straight from the heart by Harish Rathod this,Ya Tasar kar ki bhala lahn paanti ki bhabh harish rathod ho gaye ho gaye ho gay ho gay ho gay the souffull this this this this this這,25,25_歌曲_this_Short_短褲
心理議題,心情,"心情故事33 
youtubeshorts #youtube #大熱門#心情#日常#情感#nails.",心情故事33 youtubeshorts youtube 大熱門 心情 日常 情感 nails,心情故事33YouTubeshorts YouTube大熱門大熱門心情情感日常日常,27,27_日常_大熱門_故事_YouTube
心理議題,心情,Saiyaara x Saiyaara 🥹 Emotional #song #music #lovesong #saiyaara,Saiyaara x Saiyaara Emotional song music lovesong saiyaara,saiyaara x saiyaara情感歌曲音樂loveong saiyaara,25,25_歌曲_this_Short_短褲
心理議題,心情,"心情故事25 
心情#youtubeshorts #情感#youtube #大熱門#nails ##automobile #日常.",心情故事25 心情 youtubeshorts 情感 youtube 大熱門 nails automobile 日常,25 Youtubeshorts情感YouTube大熱門釘汽車日常,27,27_日常_大熱門_故事_YouTube
心理議題,心情,"Everything is for our good just trust life 😊 
Everything is for our good just trust life #EverythingIsForOurGood #HeartTouchingStory #TrustTheProcess #EmotionalShorts ...",Everything is for our good just trust life Everything is for our good just trust life EverythingIsForOurGood HeartTouchingStory TrustTheProcess EmotionalShorts,一切都是為了我們的善良 只要信任生活 一切都是為了我們的善良 只要相信生活 一切forsistouchingstory trust trust therprocorss emotionalshorts,8,8_感情_你_背叛_誰
心理議題,心情,時光飛逝 把握當下👋🏻#語錄分享 #心情語錄 #心情 #人生 #crv #crv5 #crv6 #honda #歐特氣氛燈 #語錄系列 #改車人生 #氛圍燈,時光飛逝 把握當下 語錄分享 心情語錄 心情 人生 crv crv5 crv6 honda 歐特氣氛燈 語錄系列 改車人生 氛圍燈,時光飛逝 把握當下 語錄分享 心情語錄 心情 人生 crv crv5 crv6 honda 歐特氣氛燈 語錄系列 改車人生 氛圍燈,9,9_語錄_人生_正_能量
心理議題,心情,"Saiyaara Emotional Moment | #shorts #saiyaara #emosanal 
Saiyaara Emotional Moment | #shorts #saiyaara #emosanal #ytshorts #saiyaaramoviesong #saiyaaramovietrailer #saiyaarasong ...",Saiyaara Emotional Moment shorts saiyaara emosanal Saiyaara Emotional Moment shorts saiyaara emosanal ytshorts saiyaaramoviesong saiyaaramovietrailer saiyaarasong,Saiyaara的情感時刻短褲Saiyaara Emosanal Saiyaara情感時刻短褲Saiyaara Emosanal Yshorts Saiyaararamoviesng Saiyaararamoviesng Saiyaaararamovietrailer Saiyaarasong,25,25_歌曲_this_Short_短褲
心理議題,心情,"saiyara song emotional 
Ek aadami angery crying emotional nigh mode likes.",saiyara song emotional Ek aadami angery crying emotional nigh mode likes,Saiyara歌曲情感Ek Aadami憤怒的哭泣的情感近在年模式喜歡,25,25_歌曲_this_Short_短褲
心理議題,心情,"别太着急否定一件事，可能是你今天心情不好#美团拼好饭 #补贴是一时的拼好饭是一直的#六点钟方向 #美女我爱你 
别太着急否定一件事，可能是你今天心情不好#美团拼好饭#补贴是一时的拼好饭是一直的#六点钟方向#美女我爱你.",别太着急否定一件事 可能是你今天心情不好 美团拼好饭 补贴是一时的拼好饭是一直的 六点钟方向 美女我爱你 别太着急否定一件事 可能是你今天心情不好 美团拼好饭 补贴是一时的拼好饭是一直的 六点钟方向 美女我爱你,別太着急否定一件事 可能是你今天心情不好 美團拼好飯 補貼是一時的拼好飯是一直的 六點鐘方向 美女我愛你 別太着急否定一件事 可能是你今天心情不好 美團拼好飯 補貼是一時的拼好飯是一直的 六點鐘方向 美女我愛你,11,11_喫_心情_今天_飯
心理議題,心情,"心情故事27 
youtubeshorts #人生感悟 #大熱門 #youtube #nails #心情 #日常.",心情故事27 youtubeshorts 人生感悟 大熱門 youtube nails 心情 日常,心情故事27YouTubeshorts人生感悟YouTube指甲心情心情心情日常,27,27_日常_大熱門_故事_YouTube
心理議題,心情,"播放清單 Playlist 🌷 柔和舒服的一天，用讓心情清爽愉悅的旋律度過🎶 ｜宇宙寵兒慢帝 
嘿你有沒有過，在某個平凡的時刻， 聽到某些音樂，心情會有種輕鬆、柔和感， 這個播放清單會讓我有這樣的感受，分享給你：) ...",播放清單 Playlist 柔和舒服的一天 用讓心情清爽愉悅的旋律度過 宇宙寵兒慢帝 嘿你有沒有過 在某個平凡的時刻 聽到某些音樂 心情會有種輕鬆 柔和感 這個播放清單會讓我有這樣的感受 分享給你,播放清單 Playlist 柔和舒服的一天 用讓心情清爽愉悅的旋律度過 宇宙寵兒慢帝 嘿你有沒有過 在某個平凡的時刻 聽到某些音樂 心情會有種輕鬆 柔和感 這個播放清單會讓我有這樣的感受 分享給你,28,28_愈_音樂_鬆_放
心理議題,心情,"心情故事35 
youtubeshorts #youtube #大熱門#nails #分享#心情#日常.",心情故事35 youtubeshorts youtube 大熱門 nails 分享 心情 日常,心情故事35YouTubeshorts YouTube大熱門指甲分享分享分享心情心情,27,27_日常_大熱門_故事_YouTube
心理議題,心情,"心情故事21 
youtubeshorts #youtube #正能量#大熱門#情感#nails #分享#日常#心情.",心情故事21 youtubeshorts youtube 正能量 大熱門 情感 nails 分享 日常 心情,心情故事21YouTubeshorts YouTube正能量正能量大熱門情感分享分享分享分享日常,27,27_日常_大熱門_故事_YouTube
心理議題,心情,"心情故事16 
youtube #youtubeshorts #感情#大熱門#情感#正能量#nails #日常#心情.",心情故事16 youtube youtubeshorts 感情 大熱門 情感 正能量 nails 日常 心情,心情故事16YouTube YouTubeshorts感情感情大熱門情感正能量日常日常,27,27_日常_大熱門_故事_YouTube
心理議題,心情,"deep line poetry #urdupoetry #sadpoetry #viral #viralvideo #viralshorts #foryou# 
a very beautiful heart touching collection on Mohabbat Pyar Ishq Shayari in Urdu and Hindi.. Urdu Best Motivational Quotes ...",deep line poetry urdupoetry sadpoetry viral viralvideo viralshorts foryou a very beautiful heart touching collection on Mohabbat Pyar Ishq Shayari in Urdu and Hindi Urdu Best Motivational Quotes,深線詩歌urdupoetry sadpoetry viral viral viralvideo viralshorts for for you you to in Mohabbat pyar ishq shayari在烏爾都語和印地語烏爾都,4,4_心情_浪子_雨_歌曲
心理議題,心情,你以為自己很堅強？ #人生 #心情 #語錄 #語錄分享 #人生感悟,你以為自己很堅強 人生 心情 語錄 語錄分享 人生感悟,你以為自己很堅強 人生 心情 語錄 語錄分享 人生感悟,9,9_語錄_人生_正_能量
心理議題,心情,"心情故事17 
youtube #youtubeshorts #大熱門 #nails #感情 #心情 #日常 #生活.",心情故事17 youtube youtubeshorts 大熱門 nails 感情 心情 日常 生活,心情故事17YouTube YouTubeshorts大熱門指甲感情感情感情日常生活日常,27,27_日常_大熱門_故事_YouTube
心理議題,心情,心情 #正能量 #面對自己 #推薦 #感情 #人生感悟,心情 正能量 面對自己 推薦 感情 人生感悟,心情 正能量 面對自己 推薦 感情 人生感悟,9,9_語錄_人生_正_能量
心理議題,心情,"“Dil Mein Dard Sa Jaga Hai  #SadSong #DilMeinDard  #EmotionalClip #ShayariStatus #BollywoodEm #viral 
Dil Mein Dard Sa Jaga Hai Udit Narayan Alka Yagnik Ameesha Patel Bobby Deol Bollywood Sad Song Hindi Romantic Song Old ...",Dil Mein Dard Sa Jaga Hai SadSong DilMeinDard EmotionalClip ShayariStatus BollywoodEm viral Dil Mein Dard Sa Jaga Hai Udit Narayan Alka Yagnik Ameesha Patel Bobby Deol Bollywood Sad Song Hindi Romantic Song Old,DIL MEIN DARD SA JAGA HAI SADSONG DILMEINDARD EMOTINALCLIP SHAYARISTATUS BOLLYWOODM VIRAL DIL MEIN DARD SA JAGA HAI UDIT NARAYAN ALKA ALKA YAGNIK YAGNIK AMEESHA PATEL PATEL PATEL PATEL BOBBY DEOL BOBBY BOBBY BOBBY BOBBY BOBBY BOBBY BOBBY BOBBY,25,25_歌曲_this_Short_短褲
心理議題,心情,"Sunset Motion — Strawberry Skies 🎧 #music #chillvibes #summerplaylist #shortsmusic 
Strawberry Skies A soft breeze under strawberry-tinted skies. Sweet like late-night air, smooth like a memory. Chill R&B for your ...",Sunset Motion Strawberry Skies music chillvibes summerplaylist shortsmusic Strawberry Skies A soft breeze under strawberry tinted skies Sweet like late night air smooth like a memory Chill R B for your,日落運動草莓天空音樂Chillvibes summerplaylist shortsmusic草莓天空在草莓有色天空下柔軟的微風像深夜的空氣一樣光滑 就像記憶涼爽r B,4,4_心情_浪子_雨_歌曲
心理議題,心情,有時候需要用甜甜圈來拯救壞心情🍩 #sashakolotova,有時候需要用甜甜圈來拯救壞心情 sashakolotova,sashakolotova,25,25_歌曲_this_Short_短褲
心理議題,心情,"Mera Man #trending #trendingsong #shortvideo #shorts #short #shortsfeed #sad #song 🥰👀👀 
Mera Maan #trending #trendingsong #shortvideo #shorts #short #shortsfeed #sad #song ChatGPT You said: Mera Man ...",Mera Man trending trendingsong shortvideo shorts short shortsfeed sad song Mera Maan trending trendingsong shortvideo shorts short shortsfeed sad song ChatGPT You said Mera Man,Mera Man趨勢Trendingsong Shortvideo Shorts Short Short Shortsfeed Sad歌曲Mera Maan Maan趨勢Trendingsong Shortvideo Shortvideo短褲短Short Shortsfeed Sad Sad Sod Song Chatgpt您說Mera Man,25,25_歌曲_this_Short_短褲
心理議題,心情,"Saiyaara song 🕊️👀  #love #shorts #tranding #music #emotional 
SAIYAARA SONGS (7/30 Day's) Kabhi kabhi jo sabse zyada chaha, wahi sabse pehle chhod jaata hai Agar aap bhi kabhi ...",Saiyaara song love shorts tranding music emotional SAIYAARA SONGS 7 30 Day s Kabhi kabhi jo sabse zyada chaha wahi sabse pehle chhod jaata hai Agar aap bhi kabhi,Saiyaara歌曲愛短褲訓練音樂情感Saiyaara歌曲7 30 Day S Kabhi Kabhi Jo Sabse Zyada Chaha wahi sabse sabse pehle pehle chhod jaata jaata jaata jaata hai agar aap aap aap bhi aap bhi bhi kabhi,25,25_歌曲_this_Short_短褲
心理議題,心情,"心情故事9 
youtube #youtubeshorts #人生感悟#大熱門#正能量#情感#心情#nails.",心情故事9 youtube youtubeshorts 人生感悟 大熱門 正能量 情感 心情 nails,心情故事9YouTube YouTubeshorts人生感悟人生感悟正能量情感心情心情,27,27_日常_大熱門_故事_YouTube
心理議題,心情,陳一郎 閩南語名曲「男兒漂泊的心情」💯👍❤️🌹#陳一郎#男兒漂泊的心情#京劇#北京京劇院 #青年演員全體演出謝幕#國劇#經典歌曲 #北京,陳一郎 閩南語名曲 男兒漂泊的心情 陳一郎 男兒漂泊的心情 京劇 北京京劇院 青年演員全體演出謝幕 國劇 經典歌曲 北京,陳一郎 閩南語名曲 男兒漂泊的心情 陳一郎 男兒漂泊的心情 京劇 北京京劇院 青年演員全體演出謝幕 國劇 經典歌曲 北京,4,4_心情_浪子_雨_歌曲
心理議題,心情,"心情故事28 
youtubeshorts #youtube #大熱門#心情#分享#日常#nails #automobile.",心情故事28 youtubeshorts youtube 大熱門 心情 分享 日常 nails automobile,心情故事28YouTubeshorts YouTube大熱門大熱門分享分享分享日常日常,27,27_日常_大熱門_故事_YouTube
心理議題,心情,"心情故事12 
youtube #youtubeshorts #情感#大熱門#正能量#感情#分享#nails #心情.",心情故事12 youtube youtubeshorts 情感 大熱門 正能量 感情 分享 nails 心情,心情故事12YouTube YouTubeshorts情感情感大熱門正能量感情分享心情,27,27_日常_大熱門_故事_YouTube
心理議題,心情,長大後快樂變得很難⋯ #人生 #心情 #語錄 #語錄分享,長大後快樂變得很難 人生 心情 語錄 語錄分享,長大後快樂變得很難 人生 心情 語錄 語錄分享,9,9_語錄_人生_正_能量
心理議題,心情,以前的你⋯#人生 #心情 #語錄 #語錄分享 #人生感悟,以前的你 人生 心情 語錄 語錄分享 人生感悟,以前的你 人生 心情 語錄 語錄分享 人生感悟,9,9_語錄_人生_正_能量
心理議題,心情,"情緒修復咒｜Emotional Healing Mantra｜#修復情緒 #平復心情 #心靈療癒 
情緒平復#脈輪療癒#舒緩焦慮#空間淨化#能量音樂#療癒音樂#淨化音樂#sleepmusic #healing #Relaxmusic #睡覺音樂#療癒#能量# ...",情緒修復咒 Emotional Healing Mantra 修復情緒 平復心情 心靈療癒 情緒平復 脈輪療癒 舒緩焦慮 空間淨化 能量音樂 療癒音樂 淨化音樂 sleepmusic healing Relaxmusic 睡覺音樂 療癒 能量,情緒修復咒情緒康復的咒語修復情緒修復情緒心靈療愈心靈療愈情緒平復脈輪療愈舒緩焦慮療愈音樂療愈音樂淨化音樂療愈音樂療愈音樂療愈音樂淨化音樂淨化音樂淨化音樂淨化音樂淨化音樂淨化音樂,28,28_愈_音樂_鬆_放
心理議題,心情,你是不是忘記微笑⋯ #分享 #語錄 #人生 #心情 #人生感悟,你是不是忘記微笑 分享 語錄 人生 心情 人生感悟,你是不是忘記微笑 分享 語錄 人生 心情 人生感悟,9,9_語錄_人生_正_能量
心理議題,心情,"3個動作 放鬆髖關節 心情輕鬆法｜早晨瑜伽｜你的運動x瑜伽教練 
每日朝早起身，都覺得鬱悶、冇心機返工？   可能唔係真係唔想做嘢，而係髖部僵硬影響緊你嘅情緒！ 久坐會令髖關節變得緊張， ...",3個動作 放鬆髖關節 心情輕鬆法 早晨瑜伽 你的運動x瑜伽教練 每日朝早起身 都覺得鬱悶 冇心機返工 可能唔係真係唔想做嘢 而係髖部僵硬影響緊你嘅情緒 久坐會令髖關節變得緊張,3個動作 放鬆髖關節 心情輕鬆法 早晨瑜伽 你的運動x瑜伽教練 每日朝早起身 都覺得鬱悶 冇心機返工 可能唔係真係唔想做嘢 而係髖部僵硬影響緊你嘅情緒 久坐會令髖關節變得緊張,6,6_快樂_正_能量_呼吸
心理議題,心情,"让你心情更好的音乐 ~ 放松 / 缓解压力 
让你心情更好的音乐~ 放松/ 缓解压力.",让你心情更好的音乐 放松 缓解压力 让你心情更好的音乐 放松 缓解压力,讓你心情更好的音樂 放鬆 緩解壓力 讓你心情更好的音樂 放鬆 緩解壓力,28,28_愈_音樂_鬆_放
心理議題,心情,"Mom 🥺❤️#shorts 
Mom ❤️#shorts --- mom love mother emotional story maa ka pyar heart touching short emotional short video mom sacrifice ...",Mom shorts Mom shorts mom love mother emotional story maa ka pyar heart touching short emotional short video mom sacrifice,媽媽短褲媽媽短褲媽媽愛媽媽情感故事maa ka pyar心觸摸短情緒短片媽媽犧牲,30,30_瑣事_短褲_短_歷史
心理議題,心情,"Drama: Pati Brahmachari | Characters: Esha aur Suraj | Style: Emotional Short Scene 
PatiBrahmachari #EshaAurSuraj #DramaTwist #HarialiTeej #DramaLoveStory #SurajAurEsha #HindiSerialUpdate ...",Drama Pati Brahmachari Characters Esha aur Suraj Style Emotional Short Scene PatiBrahmachari EshaAurSuraj DramaTwist HarialiTeej DramaLoveStory SurajAurEsha HindiSerialUpdate,戲劇patil brahmachari角色esha aur suraj風格的情感短片patibrahmachari eshaaursuraj dramatwist harialiteej dramalovestory surajauresha surajauresha hindiserialpddate,25,25_歌曲_this_Short_短褲
心理議題,心情,你一直以為⋯#人生 #心情 #語錄 #語錄分享 #人生感悟,你一直以為 人生 心情 語錄 語錄分享 人生感悟,你一直以為 人生 心情 語錄 語錄分享 人生感悟,9,9_語錄_人生_正_能量
心理議題,感情,#海外华人 #分享 #中外夫妻 #malaysia #singapore #情感 #熱門 #感情 #正能量 #戀愛 #香港 #澳门 #台湾 #两性 #技巧 #新加坡 #马来西亚,海外华人 分享 中外夫妻 malaysia singapore 情感 熱門 感情 正能量 戀愛 香港 澳门 台湾 两性 技巧 新加坡 马来西亚,海外華人 分享 中外夫妻 malaysia singapore 情感 熱門 感情 正能量 戀愛 香港 澳門 臺灣 兩性 技巧 新加坡 馬來西亞,1,1_夫妻_馬_海外_美國
心理議題,感情,#海外华人 #分享 #中外夫妻 #malaysia #singapore #熱門 #感情 #情感 #两性 #技巧 #技巧教学 #马来西亚 #新加坡 #香港 #澳门 #台湾 #情侶 #情人 #夫婦,海外华人 分享 中外夫妻 malaysia singapore 熱門 感情 情感 两性 技巧 技巧教学 马来西亚 新加坡 香港 澳门 台湾 情侶 情人 夫婦,海外華人 分享 中外夫妻 malaysia singapore 熱門 感情 情感 兩性 技巧 技巧教學 馬來西亞 新加坡 香港 澳門 臺灣 情侶 情人 夫婦,1,1_夫妻_馬_海外_美國
心理議題,感情,"感情勒索 
Provided to YouTube by RockRecordsTaipei 感情勒索· 張震嶽跟著感覺走℗ 2025 Rock Records Co., Ltd. Released on: ...",感情勒索 Provided to YouTube by RockRecordsTaipei 感情勒索 張震嶽跟著感覺走 2025 Rock Records Co Ltd Released on,感情勒索Rockrecordstaipei提供給YouTube的感情勒索感情勒索2025 Rock Records Co Ltd在,4,4_心情_浪子_雨_歌曲
心理議題,感情,#海外华人 #分享 #中外夫妻 #malaysia #singapore #熱門 #情感 #感情 #戀愛 #两性 #技巧,海外华人 分享 中外夫妻 malaysia singapore 熱門 情感 感情 戀愛 两性 技巧,馬來西亞新加坡馬來西亞熱門熱門情感感情技巧,1,1_夫妻_馬_海外_美國
心理議題,感情,"男女感情中的7個方法，讓對方離不開妳更害怕失去你 
在愛情的長河中，我們都渴望被珍惜、被深愛更希望這份感情能歷久彌新然而，隨著時間的推移，熱情可能漸漸褪去曾經的激情也 ...",男女感情中的7個方法 讓對方離不開妳更害怕失去你 在愛情的長河中 我們都渴望被珍惜 被深愛更希望這份感情能歷久彌新然而 隨著時間的推移 熱情可能漸漸褪去曾經的激情也,男女感情中的7個方法 讓對方離不開妳更害怕失去你 在愛情的長河中 我們都渴望被珍惜 被深愛更希望這份感情能歷久彌新然而 隨著時間的推移 熱情可能漸漸褪去曾經的激情也,8,8_感情_你_背叛_誰
心理議題,感情,#海外华人 #分享 #中外夫妻 #malaysia #singapore #熱門 #情感 #感情 #戀愛 #正能量 #两性 #香港 #澳门 #马来西亚 #新加坡 #情侶 #情人,海外华人 分享 中外夫妻 malaysia singapore 熱門 情感 感情 戀愛 正能量 两性 香港 澳门 马来西亚 新加坡 情侶 情人,海外華人 分享 中外夫妻 malaysia singapore 熱門 情感 感情 戀愛 正能量 兩性 香港 澳門 馬來西亞 新加坡 情侶 情人,1,1_夫妻_馬_海外_美國
心理議題,感情,#夫妻生活 #分享 #中外夫妻 #新加坡 #感情 #澳洲 #马来西亚 #情感 #美国,夫妻生活 分享 中外夫妻 新加坡 感情 澳洲 马来西亚 情感 美国,夫妻生活 分享 中外夫妻 新加坡 感情 澳洲 馬來西亞 情感 美國,1,1_夫妻_馬_海外_美國
心理議題,感情,"女生值不值得追，一顿饭就知道了！ #感情 #熱門 #愛情 #分享 
如果你在感情面前總是受傷失敗。想提高自己的戀愛技巧聊天能力擺脫單身可以添加我的微信xtxt551 我來幫助你。",女生值不值得追 一顿饭就知道了 感情 熱門 愛情 分享 如果你在感情面前總是受傷失敗 想提高自己的戀愛技巧聊天能力擺脫單身可以添加我的微信xtxt551 我來幫助你,女生值不值得追 一頓飯就知道了 感情 熱門 愛情 分享 如果你在感情面前總是受傷失敗 想提高自己的戀愛技巧聊天能力擺脫單身可以添加我的微信xtxt551 我來幫助你,8,8_感情_你_背叛_誰
心理議題,感情,怎麼判斷對的人 EP111 鳳小岳 #情感學習 #愛情語錄 #自我成長,怎麼判斷對的人 EP111 鳳小岳 情感學習 愛情語錄 自我成長,怎麼判斷對的人 EP111 鳳小嶽 情感學習 愛情語錄 自我成長,20,20_覺醒_越來_東方_孩子
心理議題,感情,"感情久了自然會淡，褪去激情後的相守，才是愛情真正的樣子。 #情感 #共鳴 #直覺 #生活 #兩性 #愛情 #感情 #男女 
这是他们的故事也是你们的故事.",感情久了自然會淡 褪去激情後的相守 才是愛情真正的樣子 情感 共鳴 直覺 生活 兩性 愛情 感情 男女 这是他们的故事也是你们的故事,感情久了自然會淡 褪去激情後的相守 纔是愛情真正的樣子 情感 共鳴 直覺 生活 兩性 愛情 感情 男女 這是他們的故事也是你們的故事,8,8_感情_你_背叛_誰
心理議題,感情,其实感情不是找一个最好的人，而是找一个对你最好的人。一个愿意为你放下骄傲，愿意为你倾尽所有的人。一个拼了命也要护你周全，把你融入生命的人。这才是爱情最好的归宿#情感共鸣#生活感悟 #感情 #情感,其实感情不是找一个最好的人 而是找一个对你最好的人 一个愿意为你放下骄傲 愿意为你倾尽所有的人 一个拼了命也要护你周全 把你融入生命的人 这才是爱情最好的归宿 情感共鸣 生活感悟 感情 情感,其實感情不是找一個最好的人 而是找一個對你最好的人 一個願意爲你放下驕傲 願意爲你傾盡所有的人 一個拼了命也要護你周全 把你融入生命的人 這纔是愛情最好的歸宿 情感共鳴 生活感悟 感情 情感,8,8_感情_你_背叛_誰
心理議題,感情,#健康 #情感 #分享 #美国 #感情,健康 情感 分享 美国 感情,健康 情感 分享 美國 感情,1,1_夫妻_馬_海外_美國
心理議題,感情,"【問感情：重新開始要付出的代價】專訪 許常德｜美的世界 2025.07.22 
主題：問感情：重新開始要付出的代價來賓：#許常德#美的世界#于美人#許常德#問感情#婚姻#外遇#家庭#重新開始#代價#愛情# ...",問感情 重新開始要付出的代價 專訪 許常德 美的世界 2025 07 22 主題 問感情 重新開始要付出的代價來賓 許常德 美的世界 于美人 許常德 問感情 婚姻 外遇 家庭 重新開始 代價 愛情,問感情 重新開始要付出的代價 專訪 許常德 美的世界 2025 07 22 主題 問感情 重新開始要付出的代價來賓 許常德 美的世界 於美人 許常德 問感情 婚姻 外遇 家庭 重新開始 代價 愛情,13,13_迴_戀愛_伴侶_安全感
心理議題,感情,"千万不要背叛一个对感情很纯真的人#婚姻 #夫妻 
千万不要背叛一个对感情很纯真的人#婚姻#夫妻.",千万不要背叛一个对感情很纯真的人 婚姻 夫妻 千万不要背叛一个对感情很纯真的人 婚姻 夫妻,千萬不要背叛一個對感情很純真的人 婚姻 夫妻 千萬不要背叛一個對感情很純真的人 婚姻 夫妻,8,8_感情_你_背叛_誰
心理議題,感情,#海外华人 #分享 #中外夫妻 #malaysia #singapore #熱門 #情感 #感情 #戀愛 #正能量 #情侶 #情人 #技巧 #香港 #澳门 #澳大利亚 #新加坡,海外华人 分享 中外夫妻 malaysia singapore 熱門 情感 感情 戀愛 正能量 情侶 情人 技巧 香港 澳门 澳大利亚 新加坡,海外華人 分享 中外夫妻 malaysia singapore 熱門 情感 感情 戀愛 正能量 情侶 情人 技巧 香港 澳門 澳大利亞 新加坡,1,1_夫妻_馬_海外_美國
心理議題,感情,感情的事勉强不来，一切皆是注定……#情感   #反转剧情 #感人壹幕 #搞笑  #正能量剧情  #爱情  #感情 #万万没想到 #短剧 #正能量,感情的事勉强不来 一切皆是注定 情感 反转剧情 感人壹幕 搞笑 正能量剧情 爱情 感情 万万没想到 短剧 正能量,感情的事勉強不來 一切皆是註定 情感 反轉劇情 感人壹幕 搞笑 正能量劇情 愛情 感情 萬萬沒想到 短劇 正能量,32,32_搞笑_影視_一段_精彩
心理議題,感情,人都是有感情的#解压 #情感 #人生感悟,人都是有感情的 解压 情感 人生感悟,人都是有感情的 解壓 情感 人生感悟,3,3_情感_共鳴_感情_感悟
心理議題,感情,#情感 #情感共鸣 #心灵感悟 #智慧 #感情 #正能量 #人生感悟,情感 情感共鸣 心灵感悟 智慧 感情 正能量 人生感悟,情感 情感共鳴 心靈感悟 智慧 感情 正能量 人生感悟,3,3_情感_共鳴_感情_感悟
心理議題,感情,#海外华人 #分享 #中外夫妻 #malaysia #singapore #熱門 #情感 #感情 #戀愛 #两性,海外华人 分享 中外夫妻 malaysia singapore 熱門 情感 感情 戀愛 两性,馬來西亞新加坡馬來西亞熱門熱門情感戀愛戀愛,1,1_夫妻_馬_海外_美國
