Topic,Search keyword,merged_text,cleaned_text,text_translated,topic_id,topic_label
心理議題,心理學,在愧疚的婚姻裡面，女人會成為什麼#心理學 #能量療愈 #婚姻 #女人 #智慧人生,在愧疚的婚姻裡面 女人會成為什麼 心理學 能量療愈 婚姻 女人 智慧人生,在愧疚的婚姻裡面 女人會成為什麼 心理學 能量療愈 婚姻 女人 智慧人生,15,15_女人_女性_婚姻_智慧
心理議題,心理學,"心理學說，那些化妝很少的女人，這些女人的性格是…卡爾榮格 #卡爾榮格 #心理學卡爾榮格 #卡爾榮格哲學 #分析心理學卡爾榮格 #名言 #影子理論 ＃心理學 #個性分析 #心理極限 #光之訊息 
卡爾·榮格對人性和人際關係進行了深刻的反思，尤其強調情感關係的心理層面。榮格認為，真正的友誼超越了肉體的存在和持續的 ...",心理學說 那些化妝很少的女人 這些女人的性格是 卡爾榮格 卡爾榮格 心理學卡爾榮格 卡爾榮格哲學 分析心理學卡爾榮格 名言 影子理論 心理學 個性分析 心理極限 光之訊息 卡爾 榮格對人性和人際關係進行了深刻的反思 尤其強調情感關係的心理層面 榮格認為 真正的友誼超越了肉體的存在和持續的,心理學說 那些化妝很少的女人 這些女人的性格是 卡爾榮格 卡爾榮格 心理學卡爾榮格 卡爾榮格哲學 分析心理學卡爾榮格 名言 影子理論 心理學 個性分析 心理極限 光之訊息 卡爾 榮格對人性和人際關係進行了深刻的反思 尤其強調情感關係的心理層面 榮格認為 真正的友誼超越了肉體的存在和持續的,0,0_榮格_心理_的_什麼
心理議題,心理學,【一流の人の自分の愛し方】 #自己受容 #心理学 #哲学 #言葉 #自己肯定感,一流の人の自分の愛し方 自己受容 心理学 哲学 言葉 自己肯定感,一流の人の自分の愛し方 自己受容 心理學 哲學 言葉 自己肯定感,10,10_哲學_存在_主義_體化
心理議題,心理學,"成癮心理學揭秘：為什麼我們逃不開內心的空虛？ 
探索成癮背後的心理真相！這部影片深入剖析卡爾·榮格與蓋伯·馬特的深刻見解，揭示成癮不僅是行為問題，更是內心空虛與創傷的 ...",成癮心理學揭秘 為什麼我們逃不開內心的空虛 探索成癮背後的心理真相 這部影片深入剖析卡爾 榮格與蓋伯 馬特的深刻見解 揭示成癮不僅是行為問題 更是內心空虛與創傷的,成癮心理學揭祕 為什麼我們逃不開內心的空虛 探索成癮背後的心理真相 這部影片深入剖析卡爾 榮格與蓋伯 馬特的深刻見解 揭示成癮不僅是行為問題 更是內心空虛與創傷的,0,0_榮格_心理_的_什麼
心理議題,心理學,"好かれる人の12の秘訣【心理学ベース】 
好かれる人の12の秘訣＋効果と研究 ① いつも笑顔でいる ▷ 効果：笑顔は親しみやすさと信頼感を与える。 研究：Knutson ...",好かれる人の12の秘訣 心理学ベース 好かれる人の12の秘訣 効果と研究 1 いつも笑顔でいる 効果 笑顔は親しみやすさと信頼感を与える 研究 Knutson,12個針對基於心理學的人的技巧 基於心理學的12個技巧 喜歡效果和研究1總是微笑效果效果使您友好和信任研究Knutson,7,7_心理_學_阿德勒_學知識
心理議題,心理學,"心理學家的告白：我一輩子都被別人牽著鼻子走，因此研究出影響力武器｜《影響力》第1集｜見人哥來說書 
不曉得大家有沒有想過，為什麼我們那麼容易受到廣告的影響？為什麼越貴的東西越好賣？為什麼你想買房的時候，仲介總是帶你先 ...",心理學家的告白 我一輩子都被別人牽著鼻子走 因此研究出影響力武器 影響力 第1集 見人哥來說書 不曉得大家有沒有想過 為什麼我們那麼容易受到廣告的影響 為什麼越貴的東西越好賣 為什麼你想買房的時候 仲介總是帶你先,心理學家的告白 我一輩子都被別人牽著鼻子走 因此研究出影響力武器 影響力 第1集 見人哥來說書 不曉得大家有沒有想過 為什麼我們那麼容易受到廣告的影響 為什麼越貴的東西越好賣 為什麼你想買房的時候 仲介總是帶你先,0,0_榮格_心理_的_什麼
心理議題,心理學,"好かれる人の12の秘訣【心理学ベース】 
好かれる人の12の秘訣＋効果と研究 ① いつも笑顔でいる ▷ 効果：笑顔は親しみやすさと信頼感を与える。 研究：Knutson ...",好かれる人の12の秘訣 心理学ベース 好かれる人の12の秘訣 効果と研究 1 いつも笑顔でいる 効果 笑顔は親しみやすさと信頼感を与える 研究 Knutson,12個針對基於心理學的人的技巧 基於心理學的12個技巧 喜歡效果和研究1總是微笑效果效果使您友好和信任研究Knutson,7,7_心理_學_阿德勒_學知識
心理議題,心理學,在愧疚的婚姻裡面，女人會成為什麼#心理學 #能量療愈 #婚姻 #女人 #智慧人生,在愧疚的婚姻裡面 女人會成為什麼 心理學 能量療愈 婚姻 女人 智慧人生,在愧疚的婚姻裡面 女人會成為什麼 心理學 能量療愈 婚姻 女人 智慧人生,15,15_女人_女性_婚姻_智慧
心理議題,心理學,アドラー心理学の「課題の分離」、間違った使い方してませんか？,アドラー心理学の 課題の分離 間違った使い方してませんか,您是否正在使用Adlerian心理學的問題分離,7,7_心理_學_阿德勒_學知識
心理議題,心理學,"「【雑学を徹底解説・調査！心理学「閾」【Part3】】テレビの音量はなぜ段階的？弁別閾が教える日常の科学 #心理学 #弁別閾 #shorts 」 
なぜテレビの音量を1上げても気づかないのに、10上げると「うるさい！」って感じるの？ これは心理学の「弁別閾（べんべつ ...",雑学を徹底解説・調査 心理学 閾 Part3 テレビの音量はなぜ段階的 弁別閾が教える日常の科学 心理学 弁別閾 shorts なぜテレビの音量を1上げても気づかないのに 10上げると うるさい って感じるの これは心理学の 弁別閾 べんべつ,關於瑣事心理學閾值的詳盡解釋和研究第3部分為什麼電視的數量分階段 歧視閾值心理學歧視閾值短褲所教授的每日科學為什麼當您將電視的音量提高10時會感到嘈雜 但是您不會注意到它 但是當您提高10次時 感覺很嘈雜 這是心理學的歧視閾值,29,29_係_瑣事_學與關_您
心理議題,心理學,"心理學：討厭壹個人，其實不用翻臉，最有水平的處理方式是“森田理論”【心理造夢坊】#心理 #心理學 #心理分析 #情感 #情感共鳴 #森田理论 
關系很好的表妹氣沖沖的找我吐槽其最近的煩心事：壹個同事言行十分沒有邊界感，常常擺出壹副自己和他人都很熟的樣子，不光 ...",心理學 討厭壹個人 其實不用翻臉 最有水平的處理方式是 森田理論 心理造夢坊 心理 心理學 心理分析 情感 情感共鳴 森田理论 關系很好的表妹氣沖沖的找我吐槽其最近的煩心事 壹個同事言行十分沒有邊界感 常常擺出壹副自己和他人都很熟的樣子 不光,心理學 討厭壹個人 其實不用翻臉 最有水平的處理方式是 森田理論 心理造夢坊 心理 心理學 心理分析 情感 情感共鳴 森田理論 關系很好的表妹氣沖沖的找我吐槽其最近的煩心事 壹個同事言行十分沒有邊界感 常常擺出壹副自己和他人都很熟的樣子 不光,0,0_榮格_心理_的_什麼
心理議題,心理學,"孩子有这些表现時，家长需注意！ #心理学 #青少年心理 #阿豆心理学 #注意力缺陷 
欢迎来到“阿豆心理学”  ！ 这是一个超有趣的心理学知识小天地，帮你透过心理学的视角，更好地认识自己，洞悉他人，探索奇妙的 ...",孩子有这些表现時 家长需注意 心理学 青少年心理 阿豆心理学 注意力缺陷 欢迎来到 阿豆心理学 这是一个超有趣的心理学知识小天地 帮你透过心理学的视角 更好地认识自己 洞悉他人 探索奇妙的,孩子有這些表現時 家長需注意 心理學 青少年心理 阿豆心理學 注意力缺陷 歡迎來到 阿豆心理學 這是一個超有趣的心理學知識小天地 幫你透過心理學的視角 更好地認識自己 洞悉他人 探索奇妙的,7,7_心理_學_阿德勒_學知識
心理議題,心理學,【一流の人の自分の愛し方】 #自己受容 #心理学 #哲学 #言葉 #自己肯定感,一流の人の自分の愛し方 自己受容 心理学 哲学 言葉 自己肯定感,一流の人の自分の愛し方 自己受容 心理學 哲學 言葉 自己肯定感,10,10_哲學_存在_主義_體化
心理議題,心理學,"男女で違う、恋愛感情 #雑学 #知識 #雑学豆知識 #心理学 #恋愛 #恋愛心理 #恋愛あるある #shorts 
男女で違う、恋愛感情.",男女で違う 恋愛感情 雑学 知識 雑学豆知識 心理学 恋愛 恋愛心理 恋愛あるある shorts 男女で違う 恋愛感情,男人和女人的不同浪漫情緒瑣事知識瑣事瑣事心理學浪漫愛心理學愛情事物與男人和女人的短褲不同,30,30_瑣事_短褲_短_歷史
心理議題,心理學,"実は「人の顔色をうかがう人」ほど… #心理学 #雑学 
心が軽くなる心理学.",実は 人の顔色をうかがう人 ほど 心理学 雑学 心が軽くなる心理学,實際上 人們更多地看著人的膚色 心理學 瑣事 心理學越多 使您的思想變得更輕,29,29_係_瑣事_學與關_您
心理議題,心理學,"自己肯定感が上がる心理学と人間関係の雑学30 
自己肯定感が上がる心理学と人間関係の雑学30 「実は片付けができない人は」 【ご挨拶】 動画観てくださって本当にありがとう ...",自己肯定感が上がる心理学と人間関係の雑学30 自己肯定感が上がる心理学と人間関係の雑学30 実は片付けができない人は ご挨拶 動画観てくださって本当にありがとう,30心理學和關係瑣事將增加您的自尊心心理學和關係瑣事 這將增加您的自尊心30心理學和關係瑣事 這將增加您的自尊心30個問候 如果您實際上無法清理 那些無法真正清理的人 非常感謝您觀看此視頻,29,29_係_瑣事_學與關_您
心理議題,心理學,"【グレーな心理学】嫉妬されやすい人の特徴5選 
白幕の日記帳はこちらから  】 https://youtube.com/@whitediary10 【チャンネル登録はこちらから  】 ...",グレーな心理学 嫉妬されやすい人の特徴5選 白幕の日記帳はこちらから チャンネル登録はこちらから,灰色心理學 5個容易嫉妒的人的特徵 單擊此處日記非常規窗簾 在這裡訂閱頻道,22,22_灰色_此處_單擊_閱頻
心理議題,心理學,"心理学上有个词叫：战逃反应(Fight-or-Flight）｜你的困境可能只是因为防御过度 
视频简介：心理学上有个词叫：“战逃反应（Fight-or-Flight）” | 你的困境可能只是因为防御过度** 你是否常感到愤怒失控、拖延成 ...",心理学上有个词叫 战逃反应 Fight or Flight 你的困境可能只是因为防御过度 视频简介 心理学上有个词叫 战逃反应 Fight or Flight 你的困境可能只是因为防御过度 你是否常感到愤怒失控 拖延成,心理學上有個詞叫 戰逃反應 Fight or Flight 你的困境可能只是因爲防禦過度 視頻簡介 心理學上有個詞叫 戰逃反應 Fight or Flight 你的困境可能只是因爲防禦過度 你是否常感到憤怒失控 拖延成,0,0_榮格_心理_的_什麼
心理議題,心理學,きっと為になる人間心理の雑学 #雑学 #心理学,きっと為になる人間心理の雑学 雑学 心理学,關於人類心理學的瑣事肯定會很有用,23,23_瑣事_學_心理_有用
心理議題,心理學,心理学的に心が貧しい人の特徴 #大学生 #人間心理 #人間関係 #仕事,心理学的に心が貧しい人の特徴 大学生 人間心理 人間関係 仕事,心態差的人 大學生 人類心理學 人際關係 工作的特徵,0,0_榮格_心理_的_什麼
心理議題,心理學,切記對你好的方式有兩種#心理學 #人心 #人性,切記對你好的方式有兩種 心理學 人心 人性,切記對你好的方式有兩種 心理學 人心 人性,8,8_感情_你_背叛_誰
心理議題,心理學,"自己肯定感が上がる心理学と人間関係の雑学41 
自己肯定感が上がる心理学と人間関係の雑学41 「実は動物が好きな人は」 【ご挨拶】 動画観てくださって本当にありがとう ...",自己肯定感が上がる心理学と人間関係の雑学41 自己肯定感が上がる心理学と人間関係の雑学41 実は動物が好きな人は ご挨拶 動画観てくださって本当にありがとう,心理學與關係瑣事41心理學與關係瑣事41心理學與關係瑣事41實際上 愛動物的人打招呼 非常感謝您觀看視頻,29,29_係_瑣事_學與關_您
心理議題,心理學,すぐ怒る人への正しいあしらい方 #心理学 #人間心理 #メンタルケア,すぐ怒る人への正しいあしらい方 心理学 人間心理 メンタルケア,如何正確地對待那些立即生氣的人 心理心理心理護理,0,0_榮格_心理_的_什麼
心理議題,心理學,"子どもと喧嘩したときは #shorts #不登校 #アドラー心理学 #登校拒否 #登校しぶり #発達障がい 
公式LINEはこちら▽ https://lin.ee/DY6L9vN ラギー先生こと、 河原木 孝浩(かわらぎ たかひろ)です。 アドラー心理学を基にした、 ...",子どもと喧嘩したときは shorts 不登校 アドラー心理学 登校拒否 登校しぶり 発達障がい 公式LINEはこちら ラギー先生こと 河原木 孝浩 かわらぎ たかひろ です アドラー心理学を基にした,當您與孩子短褲戰鬥時 學校逃學阿德勒心理學拒絕去學校不願去學校發育障礙 請單擊此處以獲取官方線條信息 是卡瓦拉吉高海 Kawaragi Takahiro 也稱為luggie教授 卡瓦拉吉 高希 Kawaragi Takahiro 基於阿德勒心理學,17,17_00_c_教授_對
心理議題,心理學,実はほめ言葉が人を壊すことがある？ #心理学 #雑学 #人間関係  #仕事  #習慣,実はほめ言葉が人を壊すことがある 心理学 雑学 人間関係 仕事 習慣,實際上 讚美有時會破壞人心理學瑣事人際關係工作習慣,0,0_榮格_心理_的_什麼
心理議題,心理學,絶対やってはいけない！人生を損する習慣5選#shorts #心理学,絶対やってはいけない 人生を損する習慣5選 shorts 心理学,5種習慣會損害您的生活短褲心理學,30,30_瑣事_短褲_短_歷史
心理議題,心理學,"【心理学】優しい人ほど“突然去る”６つの理由｜修復が難しい本当のワケ【その前に気づいて】 
優しい人ほど、突然いなくなる理由とは？ 「優しい人が急に連絡を絶った」 「フェードアウトして姿を消した」 そんな経験は ...",心理学 優しい人ほど 突然去る 6つの理由 修復が難しい本当のワケ その前に気づいて 優しい人ほど 突然いなくなる理由とは 優しい人が急に連絡を絶った フェードアウトして姿を消した そんな経験は,心理學 仁慈的6個原因突然突然離開了真正的原因 為什麼在此之前很難修復 我意識到善良的人是他們突然消失的原因 一個善良的人突然失去了接觸 消失了 消失了,0,0_榮格_心理_的_什麼
心理議題,心理學,"ポジティブ×３#shorts #心理学 #モチベーション #ポジティブ 
日々どういう言葉を使うかは、私たちの人生にも影響するほど重要なことです。もしネガティブ発言をしてしまったら？",ポジティブ 3 shorts 心理学 モチベーション ポジティブ 日々どういう言葉を使うかは 私たちの人生にも影響するほど重要なことです もしネガティブ発言をしてしまったら,積極的3個短褲心理動機積極的積極 我們每天使用的單詞如此重要 以至於它也會影響我們的生活 如果我們做出負面陳述,0,0_榮格_心理_的_什麼
心理議題,心理學,"自己肯定感が上がる心理学と人間関係の雑学34 
自己肯定感が上がる心理学と人間関係の雑学34 「実は1人で外食に行ける人は」 【ご挨拶】 動画観てくださって本当にありがとう ...",自己肯定感が上がる心理学と人間関係の雑学34 自己肯定感が上がる心理学と人間関係の雑学34 実は1人で外食に行ける人は ご挨拶 動画観てくださって本当にありがとう,心理學與關係瑣事34心理學和關係瑣事34實際上 可以獨自外出喫飯的人會說你好 謝謝你觀看視頻,11,11_喫_心情_今天_飯
心理議題,心理學,"心理學上有一個詞叫：“逃避式努力” 妳越努力越空虛的原因！【心理研究社】#心理學#心理健康#兩性#情感#知識#命運#知識科普#知識研究#身心健康 
心理學上有一個詞叫：“逃避式努力” 妳越努力越空虛的原因！【心理研究社】 我有個朋友，平常的時候我都叫他小梁，他最近辭職了 ...",心理學上有一個詞叫 逃避式努力 妳越努力越空虛的原因 心理研究社 心理學 心理健康 兩性 情感 知識 命運 知識科普 知識研究 身心健康 心理學上有一個詞叫 逃避式努力 妳越努力越空虛的原因 心理研究社 我有個朋友 平常的時候我都叫他小梁 他最近辭職了,心理學上有一個詞叫 逃避式努力 妳越努力越空虛的原因 心理研究社 心理學 心理健康 兩性 情感 知識 命運 知識科普 知識研究 身心健康 心理學上有一個詞叫 逃避式努力 妳越努力越空虛的原因 心理研究社 我有個朋友 平常的時候我都叫他小梁 他最近辭職了,13,13_迴_戀愛_伴侶_安全感
心理議題,心理學,"自己肯定感が上がる心理学と人間関係の雑学63 
自己肯定感が上がる心理学と人間関係の雑学63 「実は身だしなみを気にする人は」 【ご挨拶】 動画観てくださって本当に ...",自己肯定感が上がる心理学と人間関係の雑学63 自己肯定感が上がる心理学と人間関係の雑学63 実は身だしなみを気にする人は ご挨拶 動画観てくださって本当に,關於關係的心理學和瑣事 這些關係會增加自尊和瑣事關於人際關係63關於關係的心理學和瑣事 這些關係會增加自尊和瑣事的關係63實際上 如果您擔心外表 請打招呼 我真的在看視頻,29,29_係_瑣事_學與關_您
心理議題,心理學,遠野なぎこの壮絶すぎる人生　#心理学 #心理 #ホラー #恋愛 #怖い話 #都市伝説 #shorts,遠野なぎこの壮絶すぎる人生 心理学 心理 ホラー 恋愛 怖い話 都市伝説 shorts,託諾 納吉科 Tono Nagiko 的爆炸性生活 心理學 心理學 恐怖 浪漫 可怕的故事 城市傳奇 短褲,30,30_瑣事_短褲_短_歷史
心理議題,心理學,"自己肯定感が上がる心理学と人間関係の雑学74 
自己肯定感が上がる心理学と人間関係の雑学74 「実はピンク色が好きな人は」 【ご挨拶】 動画観てくださって本当にありがとう ...",自己肯定感が上がる心理学と人間関係の雑学74 自己肯定感が上がる心理学と人間関係の雑学74 実はピンク色が好きな人は ご挨拶 動画観てくださって本当にありがとう,心理與關係瑣事74心理學與關係瑣事74心理學與關係瑣事74實際上 喜歡粉紅色的人是一個問候的人 非常感謝您觀看視頻,29,29_係_瑣事_學與關_您
心理議題,自我成長,"【自我成長】討好型人格的人該如何改變自己？#討好型人格 #生活 #人際關係 #情感 #交流 #認知 #自我覺察 #情緒 #心態 #感受 #允許自己 #接納 #尊重 #愛自己 #療愈 #施威老師 
美國哈佛大學《東方智慧論壇》特邀講師，分享20年疗愈心理学经验帮助越来越多人觉醒内心的爱与力量✨带给你最亲切的关怀， ...",自我成長 討好型人格的人該如何改變自己 討好型人格 生活 人際關係 情感 交流 認知 自我覺察 情緒 心態 感受 允許自己 接納 尊重 愛自己 療愈 施威老師 美國哈佛大學 東方智慧論壇 特邀講師 分享20年疗愈心理学经验帮助越来越多人觉醒内心的爱与力量 带给你最亲切的关怀,自我成長 討好型人格的人該如何改變自己 討好型人格 生活 人際關係 情感 交流 認知 自我覺察 情緒 心態 感受 允許自己 接納 尊重 愛自己 療愈 施威老師 美國哈佛大學 東方智慧論壇 特邀講師 分享20年療愈心理學經驗幫助越來越多人覺醒內心的愛與力量 帶給你最親切的關懷,20,20_覺醒_越來_東方_孩子
心理議題,自我成長,"【自我成長】犯錯的是別人，為什麼要我改變#成長 #改變 #學習 #生命 #思維格局 #了解自己 #人生 #生活 #認知 #智慧 #覺醒 #開悟 #內心 #施威老師 
美國哈佛大學《東方智慧論壇》特邀講師，分享20年疗愈心理学经验帮助越来越多人觉醒内心的爱与力量✨带给你最亲切的关怀， ...",自我成長 犯錯的是別人 為什麼要我改變 成長 改變 學習 生命 思維格局 了解自己 人生 生活 認知 智慧 覺醒 開悟 內心 施威老師 美國哈佛大學 東方智慧論壇 特邀講師 分享20年疗愈心理学经验帮助越来越多人觉醒内心的爱与力量 带给你最亲切的关怀,自我成長 犯錯的是別人 為什麼要我改變 成長 改變 學習 生命 思維格局 瞭解自己 人生 生活 認知 智慧 覺醒 開悟 內心 施威老師 美國哈佛大學 東方智慧論壇 特邀講師 分享20年療愈心理學經驗幫助越來越多人覺醒內心的愛與力量 帶給你最親切的關懷,20,20_覺醒_越來_東方_孩子
心理議題,自我成長,"【自我成長】告別壓力爆煲💥！日本禪宗大師教你 6 大「不反應」技巧：解鎖內心平靜的秘密！🧘‍♀️ 
現代人壓力大，常常感到心力交瘁嗎？   您是否對每件事都容易反應過度，導致心力交瘁、精神內耗？   本集，我們將深入探討日本 ...",自我成長 告別壓力爆煲 日本禪宗大師教你 6 大 不反應 技巧 解鎖內心平靜的秘密 現代人壓力大 常常感到心力交瘁嗎 您是否對每件事都容易反應過度 導致心力交瘁 精神內耗 本集 我們將深入探討日本,自我成長 告別壓力爆煲 日本禪宗大師教你 6 大 不反應 技巧 解鎖內心平靜的祕密 現代人壓力大 常常感到心力交瘁嗎 您是否對每件事都容易反應過度 導致心力交瘁 精神內耗 本集 我們將深入探討日本,6,6_快樂_正_能量_呼吸
心理議題,自我成長,"真正的富養，是把更多精力投入自我成長中，而非物質消費上｜低成本富養自己的3個方法，你一定要學會｜思維密碼｜人生感悟 
如果你看完這部影片有所領悟，請點讚支持  ，訂閱我的頻道❤️。你也可以分享出去，讓更多的人受益！",真正的富養 是把更多精力投入自我成長中 而非物質消費上 低成本富養自己的3個方法 你一定要學會 思維密碼 人生感悟 如果你看完這部影片有所領悟 請點讚支持 訂閱我的頻道 你也可以分享出去 讓更多的人受益,真正的富養 是把更多精力投入自我成長中 而非物質消費上 低成本富養自己的3個方法 你一定要學會 思維密碼 人生感悟 如果你看完這部影片有所領悟 請點讚支持 訂閱我的頻道 你也可以分享出去 讓更多的人受益,24,24_也_我們_支持_回
心理議題,自我成長,#人生規劃 #面對自己 #自我成長,人生規劃 面對自己 自我成長,人生規劃 面對自己 自我成長,21,21_自由_斜槓_工作_人生
心理議題,自我成長,學會接納，你才是真正掌控自己的人 #自我成長 #强者思维 #成長 #shorts,學會接納 你才是真正掌控自己的人 自我成長 强者思维 成長 shorts,學會接納 你纔是真正掌控自己的人 自我成長 強者思維 成長 shorts,5,5_自己_自我_成長_療愈
心理議題,自我成長,尼采對道德的危險揭示！ #哲學語錄 #哲學思考 #自我成長 #人生智慧 #情感 #個體化 #存在主義 #心靈成長 #卡爾榮格 #自我覺察,尼采對道德的危險揭示 哲學語錄 哲學思考 自我成長 人生智慧 情感 個體化 存在主義 心靈成長 卡爾榮格 自我覺察,尼采對道德的危險揭示 哲學語錄 哲學思考 自我成長 人生智慧 情感 個體化 存在主義 心靈成長 卡爾榮格 自我覺察,10,10_哲學_存在_主義_體化
心理議題,自我成長,卡爾·榮格：如何真正放下一個人? #人生智慧 #自我成長 #哲學思考 #個體化 #情感 #存在主義 #哲學語錄 #心靈成長 #卡爾榮格,卡爾 榮格 如何真正放下一個人 人生智慧 自我成長 哲學思考 個體化 情感 存在主義 哲學語錄 心靈成長 卡爾榮格,卡爾 榮格 如何真正放下一個人 人生智慧 自我成長 哲學思考 個體化 情感 存在主義 哲學語錄 心靈成長 卡爾榮格,10,10_哲學_存在_主義_體化
